The arrest of Strauss-Kahn, a suave Socialist politician who until last week was a leading contender for France's 2012 presidential election, has shocked and riveted France."	"A French writer who has alleged Dominique Strauss-Kahn sexually assaulted her nine years ago has not been contacted by U.S. prosecutors who have indicted the former IMF chief on sex charges in New York, her lawyer said Monday. David Koubbi said ""there has been no attempt to get in touch."" He said his client, Tristane Banon, does not intend to assist the American prosecution, and he doesn't believe she can be forced to cooperate. ""My client is French. I am a French lawyer,"" Koubbi told The Associated Press in an interview. ""We are in two very different judicial systems. My client won't be forced to do anything by American justice."" Strauss-Kahn is on bail and under house arrest in New York, awaiting trial for allegedly attempting to rape a hotel housekeeper. He denies all charges but has resigned as head of the International Monetary Fund. Banon has alleged that Strauss-Kahn wrenched open her bra and tried to unbutton her jeans in a rape attempt in 2002. Her lawyer has said she was dissuaded from pressing charges at the time by her mother, an official in Strauss-Kahn's Socialist party. Assistant U.S. District Attorney John A. McConnell said in court last week that New York authorities were investigating at least one other case of ""conduct similar to the conduct alleged"" against Strauss-Kahn. Koubbi said that had been widely interpreted to mean Banon's case. But he said she had no intention of pressing charges while the American prosecution was going on because the two cases should be kept separate. Koubbi said that Strauss-Kahn should be convicted or acquitted on the U.S. charges alone, and if ""American investigators need to pile up two cases to obtain a conviction ... we will absolutely refuse any kind of cooperation."" He said he did not rule out Banon pressing charges after the U.S case is over _ but a 10-year statute of limitations in France means that must be done by next year. The arrest of Strauss-Kahn, a suave Socialist politician who until last week was a leading contender for France's 2012 presidential election, has shocked and riveted France. Koubbi said Banon's life had been turned upside down by her connection with the politician. He said the 31-year-old novelist ""can't live in her home anymore because her residence is constantly surrounded by journalists and paparazzi. She can't answer her mobile phone anymore. Her voice mail is full. People she hasn't seen for eight years are trying to get in touch with her because getting an interview with her is priceless."" ""Here's how she feels: She became the heart of a story without having any say in the matter."" ___ Catherine Gaschka contributed to this report."
44	The IMF after Dominique Strauss-Kahn	"Non-Europeans suspected that the Europeans were getting favorable deals under a French politician-turned-economist who wanted to return to politics.
Indeed, even back in 1973, there was substantial support for a non-European candidate, Roberto Alemann, the distinguished economist and former Argentine economics minister.
Today, the world’s overwhelming strategic problem is to adjust to a new economic and political geography, in which the weight of the global economy is shifting eastwards and southwards."	"The IMF after Dominique Strauss-Kahn Harold James, Project Syndicate, Princeton | Sat, 05/21/2011 12:30 PM | Opinion A | A | A | How the mighty International Monetary Fund has fallen. More than a decade ago, the French magazine Paris Match carried a picture of the Fund’s then Managing Director, Michel Camdessus, with the title: “The Most Powerful Frenchman in the World.” Today, his successor, Dominique Strauss-Kahn (DSK), handcuffed and grave in ubiquitous front-page photos, is the most humiliated Frenchman in the world. One unanticipated result of the lurid New York sex scandal involving DSK is that the question of his successor is attracting an unprecedented level of public interest and concern. Indeed, the scandal has exposed some fundamental problems about the IMF’s governance, and even about its existence. DSK tried to remake the IMF into a doctor of global finance, rather than a policeman. In mitigating or even preventing financial crises, however, sometimes policemen are needed. At the moment, the combination of excesses still evident in the financial sector and in public finance in many countries calls for some fairly tough police action. Any organization is always much more than simply the person who happens to lead it, but a weak or politicized figure at its head can do great damage. Unfortunately, about half of the IMF’s past managing directors have been either weak or overly political — or both. The IMF’s first two managing directors, the Belgian Camille Gutt and the Swede Ivar Rooth, were both weak figures. Indeed, the Fund almost disappeared into complete oblivion during their tenure. The IMF’s two most recent managing directors before DSK, a German and a Spaniard, were also weak. Horst Köhler, appointed in 2000, got the millennium started on a bad note. He had been an influential state secretary in Germany’s finance ministry, before becoming the head of the associations of savings banks. Germany’s then chancellor, Gerhard Schröder, pressed hard for a German appointee to lead the Fund, but Köhler was always an implausible second-choice candidate. He resigned in 2004 to run as Angela Merkel’s candidate for the largely ceremonial office of President of the German Federal Republic, a job he performed capriciously until he abruptly resigned. Köhler’s successor, Rodrigo Rato, had been the leader of Spain’s center-right party, which was unexpectedly defeated in the 2004 general election by current Prime Minister José Luis Rodríguez Zapatero. He was sent to Washington as a consolation prize, and was never very happy there. The IMF’s influence dwindled, and he resigned in 2007 “for personal reasons.” DSK, too, began his tenure at the IMF as a politician-in-exile, after emerging as French President Nicolas Sarkozy’s most formidable domestic opponent. Sarkozy and his strategists, no doubt, thought that sending DSK to the Fund, which before the global financial crisis looked unimportant and marginal, was a brilliant coup. They may have even calculated that his private life might cause a stir in a country that is both more prudish and prurient than France. But when the IMF reemerged after 2008 as a central global institution, with DSK appearing to reorient it with substantial political and economic skill, he started to look again like a threat to Sarkozy’s re-election bid. The IMF’s heavy engagement in resolving Europe’s sovereign-debt crisis adds another element of political complexity. Non-Europeans suspected that the Europeans were getting favorable deals under a French politician-turned-economist who wanted to return to politics. And some Europeans worried that the Fund was taking sides in a polarized intra-European dispute about how the costs of the financial crisis should be shared. Recent appointments to head the IMF have all been pushed through after high-level bargaining among European governments. There is now a need to break decisively with the discredited political logic that drives such decisions. The convention that the IMF’s managing director needs to be a West European is not written down anywhere, least of all in the Fund’s Articles of Agreement. Indeed, even back in 1973, there was substantial support for a non-European candidate, Roberto Alemann, the distinguished economist and former Argentine economics minister. The IMF’s history is also a guide to the kind of figure who works most productively in Washington. None of the three most powerful and influential managing directors had been a politician or government minister. Per Jacobsson, the Swedish economist who brought the Fund back from obscurity in the 1950s, had been an official at the Bank for International Settlements in Basel. As the BIS’s chief economist in the 1930s, Jacobsson knew how to use economic analysis as a basis for influence. Jacques de Larosière and Michel Camdessus were French civil servants who combined high-level technical and managerial expertise with a vision of how the world economy should operate. Today, the world’s overwhelming strategic problem is to adjust to a new economic and political geography, in which the weight of the global economy is shifting eastwards and southwards. It is tempting to conclude that appointing a well-connected figure from an emerging-market economy could solve the problem. But such an outcome would be to repeat the thinking of the past, when the main need was to broker influence between Europe and the US. Appointing an Asian political icon would merely change the names of the players; it would not reinvent the game. The IMF needs a managing director who transcends political logic and can lay out the economics of the new global order. The next one should be Eastern rather than Western, an economist rather than a politician, and a visionary rather than a tactician. The writer is Professor of History and International Affairs at Princeton University and Professor of History at the European University Institute, Florence. His most recent book is The Creation and Destruction of Value: The Globalization Cycle."
45	IMF opens selection process for new boss	"Shakour Shaalan, the dean of the IMF board who represents Egypt and a constituency of countries from the Middle East, said a selection process was broadly adopted by the 24-member board that ensures the selection will be conducted in an ""open, merit-based, and transparent"" manner.
He said candidates will be short-listed and the next managing director selected by consensus."	"WASHINGTON - The International Monetary Fund on Friday said it will accept nominations to replace Dominique Strauss-Kahn as managing director as of Monday and hopes to select the next head of the global lender by June 30. Shakour Shaalan, the dean of the IMF board who represents Egypt and a constituency of countries from the Middle East, said a selection process was broadly adopted by the 24-member board that ensures the selection will be conducted in an ""open, merit-based, and transparent"" manner. He said candidates will be short-listed and the next managing director selected by consensus. Subscribe to our Newsletter to receive news updates directly to your email"
46	Effects of IMF chief's 'perp walk' ripple outward	"We don't know whether Dominique Strauss-Kahn - who heads the International Monetary Fund and, until a few days ago, was likely to be the Socialist Party candidate for president of France - is guilty of the alleged sexual assault for which he was arrested."	"It's almost enough to give socialism a bad name. We don't know whether Dominique Strauss-Kahn - who heads the International Monetary Fund and, until a few days ago, was likely to be the Socialist Party candidate for president of France - is guilty of the alleged sexual assault for which he was arrested. Like anyone, he is presumed innocent until court proceedings prove otherwise. We do know, however, that at the time of the reported incident on Saturday, Strauss-Kahn was resident in a $3,000-a-night luxury suite at a posh Midtown Manhattan hotel. We also know that when he was taken into police custody hours later, aboard a Paris-bound jetliner that was moments from takeoff at John F. Kennedy International Airport, police found him comfortably ensconced in the first-class cabin. I didn't think this was how socialists were supposed to roll. The tinge of opulent decadence that colors the whole episode would seem, at first impression, to cast a dishonorable light upon powerful, unaccountable, jet-setting international bureaucrats in general, with perhaps a special spotlight of shame for the French-intellectual variety. But Strauss-Kahn, who is based at IMF headquarters in Washington, was apparently in New York on private business. Then again, had it been an IMF trip, Strauss-Kahn would have been covered by diplomatic immunity - and thus, perhaps, might have avoided the indignity of being held overnight in the Special Victims Unit lockup while detectives searched his person for potential DNA evidence. He almost certainly would have been spared the handcuffed ""perp walk"" as he was transferred to court for arraignment. Whatever happened took place at the Sofitel, one of the sleeker of New York's upper-echelon hotels. A 32-year-old female housekeeper - according to published reports, an African immigrant - entered Strauss-Kahn's suite to clean up, believing the guest had already departed. In her account, Strauss-Kahn emerged naked from the bathroom. She apologized and tried to leave, but Strauss-Kahn allegedly blocked her way, accosted her in the suite's bedroom, and then sexually assaulted her in the bathroom. The housekeeper reported the alleged attack to her supervisors, but by time police were called, Strauss-Kahn had checked out. He later called the hotel to say that he believed he had left his cellphone behind, however, and, according to published reports, a fast-thinking hotel employee told him - falsely - that the phone had been found and asked where it could be delivered. This is apparently how authorities learned he was at JFK, waiting to board an Air France flight to Paris. Strauss-Kahn's arrest had immediate and far-reaching impact. The most definitive seemed to be the extinction of his political career - and with it, perhaps, the best chance the Socialist Party might have had of defeating President Nicolas Sarkozy in next year's election. And the arrest came amid delicate, complicated and urgent negotiations to rescue the European Union's most threatened economies. Strauss-Kahn was a key figure in the ongoing talks, and while others can pick up where he leaves off, the financial markets could be unnerved by his absence. Even if the New York allegations turn out not to be true, the incident revived memories of an admittedly improper affair that Strauss-Kahn had with a subordinate. It's useful to be reminded that there was a time when powerful men could expect such incidents to be dismissed as misunderstandings or indiscretions, not prosecuted as criminal assaults. Yes, this sounds like the age of the dinosaurs. Dominique Strauss-Kahn gives every evidence of being one. Email Eugene Robinson at eugenerobinson@washpost.com"
47	Sight of ex-IMF head's wife rewards eager NY crowd	"Anne Sinclair, a prominent French TV journalist before her marriage to Strauss-Kahn, left the couple's temporary apartment in lower Manhattan late Sunday morning and stepped into a waiting SUV.
The 62-year-old Strauss-Kahn, once a French presidential contender, remains ensconced in the granite skyscraper as cameras and armed guards keep watch.
He is accused of attacking a 32-year-old housekeeper on May 14 in his $3,000-a-night hotel suite in midtown Manhattan."	"Anne Sinclair, a prominent French TV journalist before her marriage to Strauss-Kahn, left the couple's temporary apartment in lower Manhattan late Sunday morning and stepped into a waiting SUV. She returned four hours later, her activities a mystery. The 62-year-old Strauss-Kahn, once a French presidential contender, remains ensconced in the granite skyscraper as cameras and armed guards keep watch. Outside, open-top buses slow down as tourists snap photos of Strauss-Kahn's temporary home. Since Strauss-Kahn was moved there Friday from his Rikers Island jail cell, a crowd of international reporters has been gathered around the clock. The cost to secure him has been estimated at $200,000 a month. The funds, which he must cover, will go toward armed surveillance, the installation of cameras and a special bracelet shackled to his ankle that will set off an alarm if he travels too far. Right now, he's not allowed out of the building at all, but after he's moved to a more permanent location, he can leave for court, doctor visits and weekly religious services. Prosecutors must be notified at least six hours before he goes anywhere. He can't be out between 10 p.m. and 6 a.m. It's not clear when Strauss-Kahn will be moved, though prosecutors have said the security company advised that Broadway apartment would be available for only three or four days. He is accused of attacking a 32-year-old housekeeper on May 14 in his $3,000-a-night hotel suite in midtown Manhattan. The West African immigrant told police he chased her down a hallway in the suite, forced her to perform oral sex and tried to remove her stockings. He is scheduled for arraignment on June 6. Another Manhattan building rejected him after residents expressed fears about the kind of 24-hour media frenzy being staged on Broadway behind police barricades. Sinclair, who is wealthy in her own right, has stood by her husband since his arrest, helping secure the $5 million bond the judge added to the bail agreement. Strauss-Kahn resigned Wednesday as managing director of the International Monetary Fund, an organization that provides billions in loans to stabilize the world economy. France's finance minister, Christine Lagarde, has emerged as a front-runner to replace Strauss-Kahn, but emerging economies have pressed for an end to Europe's traditional stranglehold on the position of IMF managing director. The IMF has been accepting nominations from member countries for candidates to succeed Strauss-Kahn. Its executive board said it plans to make its selection by the end of June."
48	"Tim Geithner Calls For Official Interim IMF Chief, Others For Resignation"	"Dominique Strauss-Kahn's fall from grace has been nearly as quick as it's been painful.
Story continues below Advertisement Advertisement Advertisement Since Strauss-Kahn's arrest, additional revelations have floated to the surface, too.
One employee who claimed have a brief affair with Strauss-Kahn had warned of his behavior in writing three years ago, saying Strauss-Kahn might not be fit to hold such a powerful position."	"Dominique Strauss-Kahn's fall from grace has been nearly as quick as it's been painful. On Saturday, the head of the International Monetary Fund, previously considered a leading 2012 candidate for president of France, was arrested in New York City on charges of sexual assaulting a hotel housekeeper. By Wednesday, Strauss-Kahn, who has been denied bail, found himself in prison and on suicide watch , his reputation in shambles. With the global economy still recovering from recession and dealing with debt crises, Treasury Secretary Timothy Geithner emphasized on Tuesday the importance of the IMF quickly and ""formally"" appointing an interim leader, according to Bloomberg . ""There's a lot going on in the world,"" Geithner said. ""[Y]ou want the IMF to have the capacity to be helpful in that context,"" and Strauss-Kahn currently is ""obviously not in a position"" to do that, he continued, according to Bloomberg. Even before Geithner's comments, some European leaders, including Austrian finance minister Maria Fekter, called for Strauss-Kahn's resignation. ""Considering the situation, that bail was denied, he has to figure out for himself, that he is hurting the institution,"" Fekter said to journalists, according to the Guardian . Elena Salgado, Spain's finance minister, agrees that Strauss-Kahn must decide for himself whether to step down over the ""extraordinarily serious"" charges, according to the Financial Times . Story continues below Advertisement Advertisement Advertisement Since Strauss-Kahn's arrest, additional revelations have floated to the surface, too. One employee who claimed have a brief affair with Strauss-Kahn had warned of his behavior in writing three years ago, saying Strauss-Kahn might not be fit to hold such a powerful position. An official within the French Socialist Party has also come forward to say her daughter was attacked by Strauss-Kahn in 2002. In France, 57 percent of those polled say they believe Strauss-Kahn has been the subject of a plot. Among French Socialists, that number rises to 70 percent, according to the Guardian . Most immediately, Strauss-Kahn's resignation has thrown the state of the Greek debt crisis into doubt. Strauss-Kahn had been been particularly flexible with Greece during bailout talks, according to multiple reports. On Wednesday, an IMF envoy said that unless the debt-ridden country can sharply accelerate necessary reforms, Greece's debt program ""will run off track."""
49	China PBOC: New IMF Leadership Should Reflect New World Order	"BEIJING (MNI) - The new IMF leadership needs to reflect changes in the world economic order and be more representative of emerging market economies, Chinese central bank governor Zhou Xiaochuan said Thursday in his first public comments since the arrest of Dominique Strauss-Kahn.
Zhou also said he regretted Strauss-Kahn's decision to resign as the Managing Director of IMF.
A powerful IMF support is needed to overcome current difficulties facing Europe and ensure world economic developments are on a robust, sustainable and balanced track,"" Zhou added."	"BEIJING (MNI) - The new IMF leadership needs to reflect changes in the world economic order and be more representative of emerging market economies, Chinese central bank governor Zhou Xiaochuan said Thursday in his first public comments since the arrest of Dominique Strauss-Kahn. ""The senior management team of the IMF should better reflect changes in world economic patterns and should be more representative of emerging market economies,"" he said. Zhou also said he regretted Strauss-Kahn's decision to resign as the Managing Director of IMF. ""The current world economy is recovering slowly from the financial crisis and the European sovereign debt crisis is at a key stage. A powerful IMF support is needed to overcome current difficulties facing Europe and ensure world economic developments are on a robust, sustainable and balanced track,"" Zhou added. German Chancellor Angela Merkel reiterated earlier today that the next head of the International Monetary Fund should be a European again. beijing@marketnews.com ** Market News International Beijing Newsroom: 86-10-5864-5274 **"
