157	Sarkozy Reportedly Warned IMF Chief	"""— Charlie Sheen, (1965 - ) -------- -------- World Population To Reach 10 Billion In 90 Years With World Leaders Living In Fantasy Land — Frosty Wooldridge (Advertise Here (336x280)) You are here:Home BREAKING NEWS USA - BREAKING NEWS - OP-ED - BUSINESS - SPORT - LIFE - Leisure - KNOWLEDGE - POLITICS - GOV44.COM - OBITUARIES - PRESS RELEASES - Syndication - Privacy - Legal - About Us - Mission - FAQ - Submissions - Masthead - Tell a Friend - JOURNALIST REGISTRATION - Contact Us The Affordable Business Wire of Choice For PR Professionals ™ OfficialWire ® was founded April 24, 2001 | Journalist..."	"French President Nicolas Sarkozy reportedly warned Dominique Strauss-Kahn about his womanizing before he left for the United States in 2007. Strauss-Kahn, a former economics professor and minister of the economy and finance from 1997 to 1999, had a reputation in France for being sexually aggressive, CBS News reported. Sarkozy, who supported his appointment as head of the International Monetary Fund, warned him mores are different in Washington, The Times of London said. ""Over there they don't joke about this sort of thing,"" Sarkozy said, according to the Times. ""Your life will be passed under a magnifying glass. Avoid taking the lift alone with interns. France cannot permit a scandal."" Strauss-Kahn is being held at Rikers Island in New York after being charged with sexually assaulting a maid at a Manhattan hotel. The French newspaper Liberation reported after his arrest that in an April 28 interview Strauss-Kahn suggested a woman might make up a story about being attacked in a parking lot to win large damages, CNN said. He also suggested his reputation is overblown. A poll by the Conseil Sondage Analyses, or Council of Polling Analysis, found more than half, 57 percent, of those surveyed in France think Strauss-Kahn is a victim, not a perpetrator. Contact iWireNews.com Staff Reporter Tel: +44 07588456978 MEDIA CONTACT Posted 5/19/2011 4:40 AM Updated 5/18/2011 4:23 PM HAVE YOUR SAY - NO REGISTRATION REQUIRED HIDE THE FORM HAVE YOUR SAY - NO REGISTRATION REQUIRED HIDE THE FORM HAVE YOUR SAY - NO REGISTRATION REQUIRED -------- -------- * Your View * Name * Email * Town / City Country / State * Required Field -------- -------- (Print Article) Print (Email) EMAIL TO A FRIEND (Post to Digg) Post to Digg (Print Article) RE-PRINT PERMISSION (RSS) Local RSS Feed All form fields are required. Name Password OfficialWire is not storing your Twitter login data! Friday, May 20, 2011 ""Just sit back and enjoy the show.""— Charlie Sheen, (1965 - ) -------- -------- World Population To Reach 10 Billion In 90 Years With World Leaders Living In Fantasy Land — Frosty Wooldridge (Advertise Here (336x280)) You are here:Home BREAKING NEWS USA - BREAKING NEWS - OP-ED - BUSINESS - SPORT - LIFE - Leisure - KNOWLEDGE - POLITICS - GOV44.COM - OBITUARIES - PRESS RELEASES - Syndication - Privacy - Legal - About Us - Mission - FAQ - Submissions - Masthead - Tell a Friend - JOURNALIST REGISTRATION - Contact Us The Affordable Business Wire of Choice For PR Professionals ™ OfficialWire ® was founded April 24, 2001 | Journalist Registration To advertise on OfficialWire simply locate your desired ad type and use our automated ad server. This service is provided subject to OfficialWire's standard Terms of Service . Please read our Privacy Policy . OfficialWire ®, Give Good PR ™, Be The News...™, The Affordable Business Wire of Choice For PR Professionals ™ and The 'Official' PR Newswire ™ are trademarks owned by CPM Partnership | OfficialWire, ISSN: 1550-1531, is continuously published by CPM Partnership © Copyright 2001-2011 - CPM Partnership (Connect with OfficialWire at Kimtag)"
158	"IMF Chief Resigns, Denies Sex Assault Charges"	""" The IMF chief faces an array of charges, including two counts of first-degree criminal sexual act, one count of first-degree attempted rape, one count of first-degree sexual abuse, one count of second-degree unlawful imprisonment, one count of forcible touching and one count of third-degree sexual abuse."	"NEW YORK (CNN) -- The head of the International Monetary Fund has resigned amid mounting calls he step down after being jailed on charges he sexually assaulted a maid in his upscale hotel suite. In a brief letter to the IMF executive board late Wednesday, Dominique Strauss-Kahn proclaimed his innocence. He said he was stepping down to ""protect this institution which I have served with honor and devotion, and especially -- especially -- I want to devote all my strength, all my time and all my energy to proving my innocence."" ""To all, I want to say that I deny with the greatest possible firmness all of the allegations that have been made against me,"" he said. The resignation came as his attorneys are preparing to appeal Thursday to New York's Supreme Court to release their client on bail. He has agreed to post $1 million in cash, to be confined to home detention in Manhattan with electronic monitoring and to turn over his U.N. travel document to ""eliminate any concern that Mr. Strauss-Kahn would or could leave this court's jurisdiction,"" attorney Shawn P. Naunton wrote in the appeal. A tentative deal was in the works that could result in his release on bail as early as Thursday, a source close to the defense told CNN. The appeal adds a number of conditions, including electronic monitoring, which were not in a bail request turned down Monday by a criminal court judge in Manhattan. The appeal to the state Supreme Court describes the accused as ""a loving husband and father, and a highly regarded international diplomat, lawyer, politician, economist and professor, with no prior criminal record."" It also said Strauss-Kahn has been married for more than a decade and has four children from a prior marriage, one of whom is a graduate student at Columbia University in New York. The case has captured worldwide attention since Strauss-Kahn was pulled off an airplane and charged with the sexual assault and attempted rape of a 32-year-old Guinean maid in his hotel suite. His arrest has set French political circles abuzz as the international economist was widely considered the French Socialist Party's best hope to unseat President Nicolas Sarkozy in next year's elections. Calls for Strauss-Kahn's resignation mounted in recent days. U.S. Treasury Secretary Timothy Geithner said he was ""obviously not in a position to run the IMF."" Austria's finance minister Maria Fekter urged him to step down. ""He should think about whether he is damaging the institution,"" Fekter said. In his letter, Strauss-Kahn said he felt compelled to resign. ""I think at this time first of my wife -- whom I love more than anything -- of my children, of my family, of my friends,"" he wrote. ""I think also of my colleagues at the Fund; together we have accomplished such great things over the last three years and more."" While the search begins to replace him, John Lipsky will continue as acting managing director, the IMF said in a statement. Prosecutors allege that a naked Strauss-Kahn, 62, chased the housekeeping employee through his Manhattan hotel suite on Saturday and sexually assaulted her. But his attorney Benjamin Brafman disputed the allegation, saying ""forensic evidence, we believe, will not be consistent with a forcible account, and we believe there is a very, very defensible case."" The IMF chief faces an array of charges, including two counts of first-degree criminal sexual act, one count of first-degree attempted rape, one count of first-degree sexual abuse, one count of second-degree unlawful imprisonment, one count of forcible touching and one count of third-degree sexual abuse. Strauss-Kahn is accused of attacking the maid about noon, shortly before he checked out of the Sofitel. The maid, according to a law enforcement official, followed hotel policy by putting her cart in the open doorway of the suite when she went to clean it. After lunch, he was driven to John F. Kennedy International Airport and boarded an Air France flight, authorities said. As he sat in first class awaiting takeoff and a planned meeting the next day with German Chancellor Angela Merkel in Berlin, followed by a meeting with European finance ministers on Monday in Brussels, his world of luxury and power came crashing down. Police, alerted by hotel staff to the maid's accusations, ordered him off the plane and placed him in custody. Strauss-Kahn was examined for scratches and DNA samples were taken, and investigators searched for other evidence in the suite, including possible bodily fluids from both individuals, a law enforcement official told CNN. He consented to the testing after investigators prepared a search warrant, said the official, who spoke on condition of anonymity. The official was not authorized to release the information. CNN's Susan Candiotti, Jeffrey Toobin, Deb Feyerick, Ivan Watson, Adam Reiss, Richard Roth, Saskya Vandoorne, Caroline Paterson, David Ariosto, Raelyn Johnson and Jim Bittermann contributed to this report. Copyright CNN 2011 Comments View the discussion thread. blog comments powered by Disqus Links We Like Sponsored Links (sponsor) Most Popular On KRDO.com - Video Click to Expand - Mother Fighting For Life After Shooting Shannon Paolini is fighting for her life after her son's father shot her several times, killed their son, then turned the gun on himself. - Man Tells Coworkers Wife Dead, She Says No A man stands accused of scamming his boss and coworkers by lying about his wife having cancer. - 3,500 Ft. Carson Soldiers Bound For Afghanistan 3,500 Ft. Carson Soldiers Bound For Afghanistan - Stories Click to Expand - Ft. Carson Chopper Lands In El Paso County Field A helicopter from Fort Carson made a ""precautionary landing"" early Tuesday evening in southern El Paso county. - Store Clerk Injured In Attempted Robbery Colorado Springs police say two men attempted to rob the 7/11 on North Spruce Street early Thursday morning. The clerk was taken to the hospital after an altercation with the robbers, police said. - TARGET 13: Mother Comes Forward Concerning Cop Accused Of Buying Child Porn An arrest affidavit says a DVD of child porn was found in officer's house, next to his bed. - Mexican Population Continues Growth In Colo. The Census Bureau says Mexicans are becoming a larger part of Colorado's booming Hispanic population and their numbers are increasing in parts the state where the state is seeing some of the biggest growth. - Military Plane Crashes On Takeoff Plane crashes at Ventura Naval Air Station - Slideshows Click to Expand - 15 Best Small Cities To Raise A Family Big bustling cities are great for the young, single crowd. But that's not what most families are looking for. Forbes magazine ranks the best small cities to raise a family. - Best Of The Worst: Mug Shot Hall Of Shame Check out these lookers who ran into the law. - Rock Stars In Their 60s (Pete Townshend) Time is on the side of many of today's rockers, as many are performing well into their 60s. Take a look at some of them. - 30 Most Sleep-Deprived U.S. Cities They're not just sleepless in Seattle. Find out which U.S. cities are the most sleep-deprived."
159	The Anti-Semite Zsolt Bayer and DSK	"Zsolt Bayer, the Hungarian writer infamous for his virulent anti-Semitism has published an anti-Semitic diatribe against Dominique Strauss Kahn: “Strauss-Kahn and his IMF had their dicks sucked by half the world before the chambermaid did.
We know that he was the potential challenger of French president Sarkozy."	"Zsolt Bayer, the Hungarian writer infamous for his virulent anti-Semitism has published an anti-Semitic diatribe against Dominique Strauss Kahn: “Strauss-Kahn and his IMF had their dicks sucked by half the world before the chambermaid did. The world sucked them off for money […] so Strauss-Kahn thought after a while why a chambermaid should resist him, when half the world is sucking him off. […]” “We could leave it at that […]. We could lean back satisfied and think about how Strauss-Kahn wanted us [Hungarians] to suck him off about a year ago and how we disappointed him. […]” “Let’s see what we know about this ‘Strauss-Kahn’ except for the fact that he is the president of the IMF and likes oral sex. We know that he was the potential challenger of French president Sarkozy. This brutal, sickening old pig (er?szakos, undorító vén disznó) would have been the left’s candidate against Sarkozy. […]” “We know how lucky Sarkozy was during the last election. Do you remember? The suburbs of Paris were burning. The Arabs and other colored [sic] immigrants had set towns ablaze and went on a rampage, beating up and killing people. And while the liberal intelligentsia issued stupid statements worldwide, the French middleclass realized in the blaze of burning suburbs that they were definitely fed up with the multicultural nonsense forced on them by the likes of Strauss-Kahn [here “Jews” K. P.] because of their business interest. And while Sarkozy’s the opponents uttered the usual politically correct rubbish, Sarkozy declared unmistakably that he was fed up too and would make order. And the French middle class run off with tears in their eyes to give him their vote. And if one can’t see any anti-Semitism in Bayer’s text there are the comments of his readers on the moderated Blog of Magyar Hirlap: In comment # 114 DSK is called a “matzo-devourer” and # 119 states explicitly: “It’s interesting how unrestrained the sons of the chosen people are. While Cohn-Bendit rapes children, Strauss-Kahn frightens good looking women with his circumcised dick.” Both the owner of Magyar Hirlap and the author Zsolt Bayer are close personal friends of the Hungarian prime-minister Viktor Orbán as can be seen on a photo published on March 30, 2011. Zsolt Bayer is flanked by Viktor Orbán with a violet tie and the alibi-Jew Tamás Deutsch, who never tires of whitewashing his friend Bayer. Karl Pfeifer is a Contributing Writer for The Propagandist"
160	IMF acting head strengthens expectation European will get post	"The acting managing director of the International Monetary Fund (IMF), John Lipsky, has hinted that French Finance Minister Christine Lagarde could head the organization but said the process of selection would be open and merit-based.
Lipsky has been in caretaker charge of the IMF since Dominique Strauss-Kahn resigned on Thursday following allegations of attempted rape.
Speaking at the Peterson Institute for International Economics in Washington on Thursday, Lipsky said the agency's executive board would make the decision expeditiously."	"The acting managing director of the International Monetary Fund (IMF), John Lipsky, has hinted that French Finance Minister Christine Lagarde could head the organization but said the process of selection would be open and merit-based. Lipsky has been in caretaker charge of the IMF since Dominique Strauss-Kahn resigned on Thursday following allegations of attempted rape. The 62-year-old Frenchman, who denies all the accusations against him, was indicted on Thursday and released on $1 million bail but placed under house arrest. Speaking at the Peterson Institute for International Economics in Washington on Thursday, Lipsky said the agency's executive board would make the decision expeditiously. ""There's been agreement among our membership that the process of selection of the managing director should be open, transparent and merit-based,"" Lipsky said. Although there have been growing calls for the post to go to a non-European, with CIS members led by Kazakhstan and Russia uniting around Kazakh central banker Grigory Marchenko , many analysts have suggested that France's Lagarde would be a perfect choice. ""Of course, she's a very, very talented and capable leader,"" Lipsky said, adding that she was ""one of many names that have been mentioned."" ""Many names have been mentioned in the press. I'm happy to say many of them - a long list of them - seem extremely talented and well-qualified individuals."" German Chancellor Angela Merkel has said the next IMF head should hold a European passport, but experts say she would rather see former Bundesbank president Axel Weber in the agency's chair. Lipsky said the IMF is ""fully capable to carry out its duties"" while the leadership issue is being dealt with. ""To think that the institution was one man, however talented he might be or talented she might be, is an illusion,"" he said. ""In the past it's been a matter of a couple of months because there's a selection process and then whomever is selected may not be available to appear immediately. I expect a process that is very straightforward and normal."" MOSCOW, May 20 (RIA Novosti)"
161	2018 Winter Games bid cities make pitches to IOC - Forbes.com	"Third-time candidate Pyeongchang did what it needed to bolster its strong position, stressing it has kept all promises to the IOC through a decade of bidding and pitching the games to a new winter sports market in Asia.
"" The South Koreans brought new star power to the show, with reigning Olympic figure skating champion Kim Yu-na making her international debut to promote Pyeongchang's bid.
Another figure skating star, two-time Olympic gold medalist Katarina Witt, chairs the Munich bid."	"Third-time candidate Pyeongchang did what it needed to bolster its strong position, stressing it has kept all promises to the IOC through a decade of bidding and pitching the games to a new winter sports market in Asia. Munich enhanced its credentials as the main challenger, while Annecy showed it has improved dramatically in recent months and should not be counted out. ""I think it's very close,"" IOC President Jacques Rogge said. ""Don't ask me numbers, but it's going to be a close race, definitely. I don't expect a big gap between the three cities."" The South Koreans brought new star power to the show, with reigning Olympic figure skating champion Kim Yu-na making her international debut to promote Pyeongchang's bid. Another figure skating star, two-time Olympic gold medalist Katarina Witt, chairs the Munich bid. ""I was so much more nervous than when I was competing in the Olympics, but I think it went well,"" the 20-year-old Kim said. ""I had a little bit of a mistake, but nobody noticed, I hope. I'm very satisfied and happy that I did well."" Asked what score she would give her performance Wednesday, Kim said: ""10, yeah."" Reedie said IOC members were impressed by Kim's presentation. ""To have Miss Kim presenting as fluently and as wonderfully well as she did, it was very good for Pyeongchang,"" he said. Each city had 45 minutes for presentations featuring speeches and videos, followed by another 45 minutes for questions and answers. Rogge said members asked a total of 27 questions. The IOC said 88 of its 110 members attended the briefings at the Olympic Museum. On Thursday, the members will visit the candidate cities' exhibition rooms at a Lausanne hotel and have face-to-face meetings with bid leaders. In the day's only unusual twist, one IOC member sought to raise the issue of IMF chief Dominique Strauss-Kahn's arrest on sex assault charges in New York. Hicham el Guerrouj, a two-time Olympic gold medalist distance runner from Morocco, began to ask Annecy officials about the impact of the Frenchman's case on their bid. But Rogge cut him off, saying the question was out of place. Pyeongchang, bidding again after narrow defeats in the voting for the 2010 and 2014 Olympics, has been widely considered the favorite from the start as it seeks to bring the Winter Games to a new hub in Asia. The Winter Olympics have been held twice in Asia, both times in Japan (Sappporo 1972 and Nagano 1998). Citing a 92 percent public approval rating, by far the highest of the three candidates, Pyeongchang said its bid was a ""national priority."" Foreign Minister Kim Sung-hwan noted that South Korea had spent $1.4 billion in developing an Olympic-caliber ski resort in the Alpensia mountains and is working on a high-speed rail link between Seoul and Pyeongchang. Munich, the 1972 Olympic host which is seeking to become the first city to stage both summer and winter games, has been trying to counter Pyeongchang's status as favorite by pushing its argument for taking the games back to their European roots in a country with a long winter sports tradition. Witt said the choice of an Olympic host city is ""about more than just geography,"" a reference to Pyeongchang's case for taking the Winter Games to Korea for the first time. ""It is a choice about the kind of Olympic experience the athletes of the future should have,"" she said. American IOC member Anita DeFrantz asked the Germans about the terrorist attack at the 1972 Munich Olympics that left 11 Israeli athletes and coaches dead. ""The mayor (Christian Ude) could explain that the incident in '72 had nothing to do with Munich as a city or with Germany,"" said Thomas Bach, an IOC vice president who is a senior Munich bid leader. ""It was just the beginning of international terrorism, and we appreciated this question to make this clear."" Annecy is seeking to establish itself as a true contender after being seen as a longshot for much of the race. After going through financial and leadership troubles, the bid has been strengthened in recent months. ""I think we are all three even now,"" IOC member and French ski great Jean-Claude Killy said. ""We showed we are a good team. We have a good proposition. We are proud of it. We think we have nothing to envy of the other two bids."" Copyright 2011 The Associated Press. All rights reserved. This material may not be published, broadcast, rewritten or redistributed."
162	Strauss-Kahn is released on bail	NEW YORK/WASHINGTON (Reuters) - Fallen IMF chief Dominique Strauss-Kahn left jail on bail on Friday and was whisked to a safe house off Wall Street where he will be held under round-the-clock armed guard.	"NEW YORK/WASHINGTON (Reuters) - Fallen IMF chief Dominique Strauss-Kahn left jail on bail on Friday and was whisked to a safe house off Wall Street where he will be held under round-the-clock armed guard. French Finance Minister Christine Lagarde led the race to succeed him in the top job in global finance. But developing countries, whose clout in the world economy has grown in recent years, kept up pressure on Europe and the United States to avoid a backroom deal over the appointment. - Related - (Photo: Dominique Strauss-Kahn's mug shot) Photo: Photo: Dominique Strauss-Kahn's mug shot - (Europe races to claim top job at IMF) Story: Europe races to claim top job at IMF - (Pictures: Dominique Strauss-Kahn) Photos: Pictures: Dominique Strauss-Kahn - (Strauss-Kahn lawyers see alibi in sex case: report) Story: Strauss-Kahn lawyers see alibi in sex case: report - Story: IMF chief resigns, debate on successor heats up - Photo: - Topics - New York - Justice System - Lawyers - See more topics » - X Sex Crimes Crimes Judges Prosecution Rape Dominique Strauss-Kahn Strauss-Kahn, indicted for allegedly trying to rape a hotel housekeeper last Saturday, left New York's Rikers Island jail after a judge said bail conditions had been met. Photographers gathered outside an apartment building in New York's financial district where he was expected. A man held up a placard on which was scribbled ""D.S.K., Not In My Backyard"" -- referring to Strauss-Kahn's initials. Strauss-Kahn, 62, later arrived at another building on Broadway, in the same area, a police source said, to spend a few days before a more permanent home is found for him in the city during potentially long legal proceedings. He will be subject to electronic monitoring around the clock and must wear a tracking device on his ankle. The former French finance minister was once seen as a strong contender to be the next president of France and he played a central role in tackling the global financial crisis of 2007-09. He denies the charges and has vowed to prove his innocence. He resigned from the International Monetary Fund on Wednesday. Strauss-Kahn's lawyers posted $1 million in bail and a $5 million insurance bond, as ordered by a judge on Thursday. Lagarde was in pole position to take over his job as many of Europe's capitals rallied behind her. She has been praised for her role in tackling the European debt crisis and for her experience, with France this year chairing the Group of 20, in handing the often conflicting economic demands of advanced and developing economies. The IMF has been run by a European ever since it was created at the end of World War Two. The challenge for emerging economies to break Europe's grip on the job got tougher when the most widely tipped potential candidate from among their ranks ruled himself out. German Chancellor Angela Merkel all but endorsed Lagarde, telling a news conference she rated her highly. Chairman of the U.S. law firm Baker & McKenzie in Chicago before joining the French government in 2005, she is a fluent English speaker. She would be the first woman to head the IMF. Diplomats said some European Union countries questioned whether Lagarde could be anointed before a special court decides next month whether she should be investigated in a French legal case. Singapore's Finance Minister Tharman Shanmugaratnam, who heads the IMF's key policy-steering panel, said the world body faced pressing challenges and must quickly pick a new head. ""It is also imperative that the process be open, transparent and merit-based, so as to ensure the selection of a highly capable candidate...."" he said in a statement. EMERGING NATIONS SEEK CANDIDATE"
163	Maids fear male guests	"Advertisement NEW YORK (AP) — Hotel housekeepers say they often feel a twinge of fear when they slide the keycard, turn the door handle and step into a room to clean it.
