1	Dominique Strauss-Kahn Sex-Crime Case: Accuser Lived In Apartment For HIV/AIDS Patients	The New York Post has learned that the woman accusing IMF boss Dominique Strauss-Kahn of sexual assault lived in an apartment exclusively for patients with HIV and AIDS.	"The New York Post has learned that the woman accusing IMF boss Dominique Strauss-Kahn of sexual assault lived in an apartment exclusively for patients with HIV and AIDS. From the Post: The hotel maid, a West African immigrant, has occupied the fourth-floor High Bridge pad with her 15-year-old daughter since January -- and before that, lived in another Bronx apartment set aside by Harlem Community AIDS United strictly for adults with the virus and their families. The paper was unable to confirm if the accuser has HIV or AIDS because of medical confidentiality laws, but the Post confirmed that the agency rents apartments only for adults with the disease. A Harlem United employee said at least one adult in the apartment must be HIV-positive or have AIDS to qualify to live in one of the residences. Sources told the Post that only the alleged victim and her child lived in the apartment. Strauss-Kahn is accused of forcing the woman to perform oral sex on him. She told police that after the forced act, she spit his semen onto the floor. According to the federal Centers for Disease Control : ""It is possible for either partner to become infected with HIV through performing or receiving oral sex."" Strauss-Kahn is on suicide watch at Rikers Island jail. Calls intensified for Strauss-Kahn to step down as head of the International Monetary Fund, with U.S. Treasury Secretary Timothy Geithner saying Strauss-Kahn ""is obviously not in a position to run"" the agency. Strauss-Kahn: Lasting Implications For IMF? FOLLOW HUFFPOST NEW YORK ON Facebook: Like 4 Twitter: Enter Email Address GET ALERTS CONTRIBUTE TO THIS STORY - Send Corrections - Send us a Link - Contact us - Send a Tip - Send Photos/Videos - Comment - Dominique Strauss-Kahn - New York Crime - NY News The New York Post has learned that the woman accusing IMF boss Dominique Strauss-Kahn of sexual assault lived in an apartment exclusively for patients with HIV and AIDS. From the Post: The hotel... The New York Post has learned that the woman accusing IMF boss Dominique Strauss-Kahn of sexual assault lived in an apartment exclusively for patients with HIV and AIDS. From the Post: The hotel..."
2	Strauss-Kahn’s NY apartment plan falls apart	"Strauss-Kahn’s NY apartment plan falls apart AFP/New York Former IMF chief Dominique Strauss-Kahn’s release on bail was thrown into disarray yesterday when plans to put him up in a posh New York flat pending trial on sexual assault charges fell apart, a report has said.
But the New York Post tabloid, quoting unnamed sources, said Strauss-Kahn’s departure from jail may have to be put on hold after Bristol Plaza residents found out about his plans to move in and complained."	"Strauss-Kahn’s NY apartment plan falls apart AFP/New York Former IMF chief Dominique Strauss-Kahn’s release on bail was thrown into disarray yesterday when plans to put him up in a posh New York flat pending trial on sexual assault charges fell apart, a report has said. Journalists were staking out a glitzy-looking apartment building - the Bristol Plaza on East 65th Street in Manhattan - which New York television said had been rented by Strauss-Kahn’s wife, Anne Sinclair. But the New York Post tabloid, quoting unnamed sources, said Strauss-Kahn’s departure from jail may have to be put on hold after Bristol Plaza residents found out about his plans to move in and complained. One source said that “someone high-profile in the building” had objected to Strauss-Kahn staying, the Post reported. Asked if an apartment had been rented in the name of Sinclair or Strauss-Kahn, a building supervisor responded dryly, saying: “We have no guests at such name.” Strauss-Kahn, who has spent the last four nights inside Rikers Island jail after being charged with alleged sexual assault, was due to be freed wearing an electronic ankle bracelet and after posting a $1mn bail. Before he can be reunited with his wife, the man once strongly tipped to be the next president of France must also put up a $5mn bond. His lawyers will also have to satisfy judge, Michael Obus, that plans are in place for him to be placed under 24-hour surveillance, complete with video cameras, and a round-the-clock armed guard. The tough bail conditions - which will cost some $200,000 a month - were imposed after the veteran French politician was indicted on charges of sexual assault, attempted rape and unlawful imprisonment of a 32-year-old chambermaid. The Post report threw into doubt expectations that the bail package would be signed and sealed yesterday. A grand jury has indicted the 62-year-old French Socialist power baron on all seven charges arising from Saturday’s alleged sexual assault at Manhattan’s luxury Sofitel hotel. Strauss-Kahn has denied all the charges, and resigned as head of the International Monetary Fund to devote his time to fighting to clear his name. If convicted he could be forced to spend the rest of his life behind bars. Strauss-Kahn has not yet entered a formal plea. That is expected to come at his next court appearance on June 6."
3	Why is France Falling for <em>Strauss-Kahn</em> Conspiracy Talk?	"According to a worrying CSA poll, it seems that 57% of the French believe that Strauss-Kahn’s arrest results from a conspiracy.
Not long after Mitterrand’s death, the French public was surprised to discover an interview made by a Belgian TV channel in which Mitterrand dismissed a journalist for being too insistent about a recent scandal involving Mitterrand’s presidential staff illegally wiretapping various French public figures."	"According to a worrying CSA poll, it seems that 57% of the French believe that Strauss-Kahn’s arrest results from a conspiracy. The numbers have many Americans wondering: have the French lost their minds? There are though many reasons to explain the polling result. As has been written about everywhere since last Sunday, French political culture is traditionally much more tolerant about sexual matters than America’s political culture. French president Felix Faure (1841-99) famously died in a Paris brothel, and that didn’t cause much of a shock. Clemenceau quipped that the best part of love was the climb up the stairwell.  He meant: in a brothel. As far as French voters and the press are concerned, any legitimate act between consenting adults is fine and not much to worry about it. Americans are of course more religious than the French, yet that doesn’t really explain the differing views.  The French were more religious in Faure or Clemenceau’s eras than Americans today. And in any case, the lack of interest in politicians’ private lives is could itself be compatible with a generally moral attitude regarding politics, at least in theory. The problem is that it just isn’t so. In Strauss-Kahn’s case, as could be suspected, other stories are now emerging about previous incidents: one including Tristane Banon, a journalist Strauss-Kahn seems to have assaulted in 2001 or 2002 (reports differ), and a Mexican chambermaid during an official trip at a later date. Obviously, these incidents go much further than private life issues. When Strauss-Kahn was appointed to run the IMF, Jean Quatremer, a journalist from the daily Libération, blogged about possible coming troubles due to DSK’s incapacity to control his urges, but the profession ignored him while Strauss-Kahn’s communication staff asked him to remove the post (which he refused to do). What is emerging now is the realization that every political journalist in Paris was aware of the allegations surrounding Strauss-Kahn’s behavior and failed to reveal them.  No one was there to blow the whistle. Even if we put Strauss-Kahn aside, there’s a larger question: what other stories is the press holding their silence on? The French understand that there is a sense of “omerta” at work, an implicit vow of silence on the part of the media that may very well cover much more than just sexual or intimate issues. Most French papers couldn’t survive in the marketplace alone and are only still in business after having been bought out by a larger industrial group.  For their new owners, good relations with the government may be important. Other players in the French media often rely on financial aid from the state. Public TV and radio are big players too and the news agency AFP is a public company. As a profession, journalists share various corporate interests, fiscal or otherwise. The bottom line is that French journalists depend heavily on the state and are strongly unionized as well. Add to that the fact that politicians and journalists depend on each other for publicity and scoops and the general discretion about politicians’ intimate lives gets easier to understand. What remains uncertain is whether the press does a better job when it comes to reporting on corruption in general. Unfortunately, it doesn’t seem to be the case. Not long after Mitterrand’s death, the French public was surprised to discover an interview made by a Belgian TV channel in which Mitterrand dismissed a journalist for being too insistent about a recent scandal involving Mitterrand’s presidential staff illegally wiretapping various French public figures. The scandal was known in France, but the interview, which showed Mitterrand in a very bad light, wasn’t released until he was out of office. The French public has been kept in an isolated news vacuum many times.  The near-complete consensus against the Iraq war in 2003 is partly explained by the almost compete absence of any dissenting points of view in the media during this period (in addition to some outright lies in reporting). The current atmosphere, with politicians feigning “shock” about Strauss-Kahn’s attack allegations and more or less insinuating that he is in trouble because he’s an affluent and influential Frenchman, are reminiscent of this period. All that makes it relatively unsurprising, but depressing, to discover that a majority of the French believe in a conspiracy against Strauss-Kahn (although there isn’t even a theory underpinning that belief). Less than a week ago, Strauss-Kahn was thought to be not exactly a perfect family man, but still a respectable person, thanks to the media’s omerta — and now he is in jail. It may take some time for the French public to make sense of it all. Hopefully though the scandal will make the public open their eyes a little more. Tweet"
4	Traces of Strauss-Kahn's DNA found on alleged victim's clothing	"Traces of Strauss-Kahn's DNA found on alleged victim's clothing Former IMF chief Dominique Strauss-Kahn Crime scene investigators have found traces of the DNA of former IMF International Monetary Fund chief Dominique Strauss-Kahn in the clothes of the hotel maid that accused him of sexual assault and rape attempt, media outlets reported.
The results of the possible traces of Strauss -Kahn’s DNA collected from the alleged victim’s clothing and from the Sofitel room where the incident took place on May 14th, were expected this week."	"Traces of Strauss-Kahn's DNA found on alleged victim's clothing Former IMF chief Dominique Strauss-Kahn Crime scene investigators have found traces of the DNA of former IMF International Monetary Fund chief Dominique Strauss-Kahn in the clothes of the hotel maid that accused him of sexual assault and rape attempt, media outlets reported. According to NBC network, traces of Strauss-Kahn’s semen were found on the collar of the shirt belonging to the hotel maid, a Guinean 32 year old woman whose identity has not been revealed by authorities. The results of the possible traces of Strauss -Kahn’s DNA collected from the alleged victim’s clothing and from the Sofitel room where the incident took place on May 14th, were expected this week. Strauss-Kahn remains under house arrest since Friday night, six days after being detained on charges of sexual assault. The former IMF chief can only leave the apartment for medical reasons. Once he is taken to the apartment he will live in durong the duration of the trial, he will be able to leave for lawyer meetings, medical visits and for synagogue outings. Strauss Kahn quit as chief of the influential International Monetary Fund last week, and the organization has yet to name his successor. - (Comment) Comment - (Increase font size) (Decrease font size) Size - (Email article) email - (Print) Print - Share - - - - - - - - - Vote (Not interesting) (Little interesting) (Interesting) (Very interesting) (Indispensable) Tags: strauss kahn IMF dna sample - (Comment) - (Increase font size) (Decrease font size) - (mail) - (Print) COMMENTS > (Comment) Search... (Search) Get to File (e-planning.net ad) - LATEST NEWS - MOST POPULAR - BEST RANKED - Traces of Strauss-Kahn's DNA found on alleged victim's clothing - 'The time has come to strengthen our alliance,' Alfonsín tells Binner - Palestinians' Fayyad had heart attack in US, stable - Elizabeth Taylor's home goes on sale for US$8.6 million - Russell Brand deported from Japan, wife Katy Perry says - 'Para vestir Santos' wins top award - Remains of former Chile president Salvador Allende exhumed - Monster tornado kills at least 116 in Missouri - Wall Street drops as euro zone concern weighs - UK, US launch joint national security body - Keiko Fujimori leads race in Peru polls - Novak Djokovic and Francesca Schiavone advance at French Open - Wall Street drops as euro zone concern weighs - Socialists crushed in Spain’s local elections (e-planning.net ad) (Grupo ámbito) (ámbito financiero) (ambito.com) (Docsalud) (alrugby.com) (Premium) (ávp) (El Ciudadano) (El Tribuno) (Management) (Pesca Caza) Director: Orlando Mario Vignatti - Edition No. 3056 - This publication is a property of NEFIR S.A. - Issn 1852 - 9224 - Te. 4349-1500 - Paseo Colón 1196, (C1063ACY) CABA"
5	Dominique Strauss-Kahn Resigns as IMF Chief	"The French doesn't always have a high opinion of Americans in general.
Flag It Permalink Reply (–) Show Replies Collapse Replies 8:48 am, May 19, 2011 pclayton Good points, whether or not house learns anything from it.
Flag It Permalink 10:19 am, May 19, 2011 Dr_SwampGas Goodbye, creep.
I think the John Birch society was right all along, that there is a network of International Socialist bankers trying to force themselves on this nation to undermine our traditions, values and very the notion of God."	"Sajwert houseparty, usually I try not to answer people like you as nothing penetrates a steeled bias or bigotry. But, here goes. The French doesn't always have a high opinion of Americans in general. They most often think we are unsophisticated, parochial, narrow-minded (especially about sex), and worst of all, we do NOT speak French. They give greater benefits to people in power when it comes to dishonest actions, and perp walks are absolutely never done in France. However, they have no compunction about printing the name of the victim, making sure that people know about HER, but little if anything about HIM. That said, 69% of people who believe this is a set-up are willing to cut slack for a man who has a philandering history, who has had some questionable situations with females under his power. None of what I've written, I realize, is going to be even read by you probably, forget about your considering it. Flag It Permalink Reply (–) Show Replies Collapse Replies 8:48 am, May 19, 2011 pclayton Good points, whether or not house learns anything from it. Flag It Permalink 10:19 am, May 19, 2011 Dr_SwampGas Goodbye, creep. Who will be the new bankster in charge? Flag It Permalink Reply 2:29 am, May 19, 2011 Glenda1976 I was wondering just yesterday, would the government of Greece have to call Rikers to find out if they would get another bailout. Flag It Permalink Reply 8:06 am, May 19, 2011 AnyoneforTea Other than the salacious details of this case I have a few questions and no one in media or government seems to have those answers. Just what is the IMF? What is their charter , do thy have a mission statement? How much US money have they received over the years? What Happened to the money? How much more money do they want? Did the money go to dictators or bankers and which is worse? Is there an account or some ledger we can look at? Did we get a receipt for the last 100 billion we gave them? What was Mr DSK's annual salary or was he free to grab as much as possible? Talk about a Global Socialist conspiracy of bankers, and people pull out tin-foil hats yet here we have one, so let's get some answers from him. We know the news media will not tell us anything they are ignorant themselves. So who will tell us the truth of the IMF and the likes of DSK? I think the John Birch society was right all along, that there is a network of International Socialist bankers trying to force themselves on this nation to undermine our traditions, values and very the notion of God."
6	"It would be ideal if IMF boss would quit now, say directors"	"THERE was growing pressure on Dominique Strauss-Kahn to step down as head of the International Monetary Fund (IMF ) last night.
"" The Spanish finance minister added her voice, saying that the IMF head faced ""very serious accusations"" but that any resignation ""is only a decision that Mr Strauss-Kahn can take"".
Mr Strauss-Kahn (62) had been due to attend an EU finance ministers' meeting in Brussels to discuss bailouts.
However, according to the Portuguese finance minister, Fernando Teixeira dos Santos , the IMF head's absence had not been an issue."	"THERE was growing pressure on Dominique Strauss-Kahn to step down as head of the International Monetary Fund (IMF ) last night. Last night the IMF 's board announced that it was seeking to contact jailed Mr Strauss-Kahn to hear his views on his plans regarding his post. The board has the authority to remove Mr Strauss-Kahn from his post. One of the sources said it would be ideal if Mr Strauss-Kahn resigned, although the other said that sentiment was not universally shared across the 24-member board of member countries. Meanwhile, Austrian finance minister Maria Fekter called outright for the beleaguered finance guru to consider his position. And her Spanish counterpart, Elana Salgado, gave her support for the victim of his alleged sexual assault. Refused ""I don't comment on judicial matters,"" said Ms Fekter. ""But in view of the situation, that bail has been refused, he himself must deliberate on whether he is hurting the institution."" The Spanish finance minister added her voice, saying that the IMF head faced ""very serious accusations"" but that any resignation ""is only a decision that Mr Strauss-Kahn can take"". However, she went on to express sympathy for the alleged victim of the assault: ""If I had to show my solidarity and support for someone, it would be towards the woman who has been assaulted, if that is really the case."" Irrespective of the legal outcome, Mr Strauss-Kahn's detention creates a practical obstacle for his role in negotiating rescue loans for Portugal and Greece. Mr Strauss-Kahn (62) had been due to attend an EU finance ministers' meeting in Brussels to discuss bailouts. However, according to the Portuguese finance minister, Fernando Teixeira dos Santos , the IMF head's absence had not been an issue. French writer Tristane Banon (31) also alleges Mr Strauss-Kahn assaulted her in 2002. It also emerged that an employee who had a brief affair with him warned the organisation about his behaviour toward women three years ago. - Claude Rayon in Paris Irish Independent"
7	when he did time on Rikers Island in 2010 on a gun charge. His album	"IMF director general Dominique Strauss-Kahn stands before judge Melissa Jackson in Manhattan Criminal Court.
Instead, the head of the International Monetary Fund is accused of sexual abuse and rape and is spending the day in at 3.35 x 4 meter cell at Rikers Island jail in New York."	"IMF director general Dominique Strauss-Kahn stands before judge Melissa Jackson in Manhattan Criminal Court. As one of the most powerful men in global economics, Dominique Strauss-Kahn was supposed to give the keynote speech at the Brussels Economic Forum in Belgium on Wednesday. Instead, the head of the International Monetary Fund is accused of sexual abuse and rape and is spending the day in at 3.35 x 4 meter cell at Rikers Island jail in New York. If the name of the IMF chief's new digs rings a bell with you, chances are you've heard it on TV.  Rikers Island is best known as the home of suspects pending trial or convicts serving short sentences and as such it features regularly in New York-based police dramas such as NBC's ""Law and Order"". It evens has its own page on the show's wiki . In many ways Strauss-Kahn's arrest could be straight out of an episode of ""Law and Order: SVU"", the strand of the show that portrays detectives investigating ""sexually based offenses"". Sadly, this is real life. It was real too for rapper Lil' Wayne when he did time on Rikers Island in 2010 on a gun charge. His album ""I Am Not A Human Being"" was released while he was in solitary confinement, and he even recorded a verse over the phone for the Drake/Jay-Z single ""Light Up"". The ""Rikers Remix"" did the rounds online. Rikers Island, where IMF head Dominique Strauss-Kahn is being held. Lil' Wayne is just one of many artists to have referenced Rikers Island in their lyrics. Recent Eminem/D12 collaboration ""Going Crazy"" describes a ""tour bus look like Rikers Island"". Meanwhile, if Kool G. Rap's lyrics are anything to go by, Dominique Strauss-Kahn may have a rough time in store at the jail: ""...you might have been robbin', you might have been whylin'/ But you won't be smilin' on Rikers island. / Just to hear the name it makes your spine tingle/ This is a jungle where the murderers mingle/ This ain't a place that's crowded but there's room for you/ Whether you're white or you're black, you'll be black and blue..."" This Wednesday we heard that the man whom many refer to as DSK was placed on suicide watch at Rikers Island, but that is a common procedure in high-profile cases. Strauss-Kahn is expected to be left largely alone between now and his next appearance in court on Friday. CNN Legal Analyst Sunny Hostin says a second application for bail will be the top priority. ""There is no question that this Friday the defense will reapply for bail"", he told CNN's Anderson Cooper 360 . ""They're going to try to come up with a situation that is palatable for the prosecution and the court so that he is no longer being held at Rikers Island. That may include $1 million to $2 million bail, or an ankle monitoring bracelet"". As the Grand Jury convenes, the world will be watching. Posted by: Ally Barnard , CNN Producer Filed under: General"
8	"Dominique Strauss-Kahn Remains In Pricey, Temporary NY Apartment"	"NEW YORK -- With armed guards and cameras watching his every move, former IMF leader Dominique Strauss-Kahn remained holed up Sunday in a pricey high-rise while he awaits a more permanent location for house arrest in his sexual assault case.
The onetime French presidential contender has been living in the lower Manhattan skyscraper since his release Friday from Rikers Island on $1 million bail."	"NEW YORK -- With armed guards and cameras watching his every move, former IMF leader Dominique Strauss-Kahn remained holed up Sunday in a pricey high-rise while he awaits a more permanent location for house arrest in his sexual assault case. The onetime French presidential contender has been living in the lower Manhattan skyscraper since his release Friday from Rikers Island on $1 million bail. He's been accused of trying to rape a housekeeper in his $3,000-a-night hotel suite last weekend but has denied the allegations. He's scheduled for arraignment on June 6. The 62-year-old Strauss-Kahn was initially set for a tony apartment complex on the Upper East Side, but tenants in the building complained about the throng of police and media gathered outside. So instead, Strauss-Kahn was ensconced in the 21-story Empire Building within the New York Police Department's ring of steel, a network of private and police cameras. It's not clear when and where he'd be moved to a more permanent house arrest; calls to his attorney and to the security firm weren't returned. Even with the severe restrictions, Strauss-Kahn's family wealth has afforded him one of the cushiest bail agreements possible. But it won't come cheap. The cost to secure the former International Monetary Fund chief was estimated at $200,000 a month – and he must foot the bill. In comparison, it costs the city about $6,500 a month to house an inmate at a facility like Rikers Island, where he had been held nearly a week. The funds will go toward armed surveillance, the installation of cameras and a special bracelet shackled to his ankle that will set off an alarm if he travels too far. Right now, he's not allowed out at all, but after he's moved to a more permanent location he can leave for court, doctor visits and weekly religious services. Prosecutors must be notified at least six hours before he goes anywhere. He can't be out between 10 p.m. and 6 a.m. But he won't be lonely: Strauss-Kahn can have visitors – up to four at a time in addition to family. Meanwhile, the IMF has been working to find a successor to lead an organization that provides billions in loans to stabilize the world economy. France's finance minister, Christine Lagarde, has emerged as a front-runner to replace Strauss-Kahn. The executive board said it plans to make its selection by the end of June."
