99	EU Rehn: Greece Must Take Steps In Coming Days; Debt 'Reprofile' Option	#NAME?	"(Adds comments, including on Strauss-Kahn in new final two paragraphs) BRUSSELS -(Dow Jones)- Greece has promised to announce new efforts in the coming days to tackle its economic crisis, the European commissioner for economic affairs said Tuesday. Commissioner Olli Rehn said the measures are ""indispensable"" before euro zone countries can consider further steps to help the debt-strapped country avoid default. In particular, Greece must immediately carry through on its plans to raise EUR50 billion by selling state assets, including EUR15 billion this year, he said after talks with European finance ministers. Rehn said a restructuring of Greek debt is not an option. However, a ""reprofiling,"" or voluntarily extension of loan maturities held by private investors, could be examined, he said. ""The Greek government has committed to taking further measures of fiscal consolidation in the coming days"" to meet its budget deficit targets for 2011 and future years, Rehn said. He said the measures must have must have broad political support. ""If it is possible for Portugal and Ireland, how come not in Greece?"" said Rehn. Political parties in Ireland and Portugal had to swallow some of their differences in return for bailouts from the European Union and the International Monetary Fund. Greece continues to struggle under its heavy debt load a year after it secured its own EUR110 billion rescue package on promises to meet tough fiscal targets. The EU and IMF are now reviewing the country's efforts. Rehn said he trusts that Athens will receive its next loan disbursement after the review. Rehn also answered questions on the potential need to fill the position of the IMF managing director after the arrest of the current chief, Dominique Strauss-Kahn. ""Europeans have a strong interest in this post,"" he said, adding that the IMF is playing a key role in addressing the sovereign debt crisis. -By Riva Froymovich and William Horobin, Dow Jones Newswires; riva.froymovich@dowjones.com - print this - rss feed - email alerts More Like This... - Reuters launches Dealing Aggregator Thomson Reuters has launched a new FX aggregation service, available exclusively to users of the Thomson Reuters Dealing service on a proprietary or hosted basis. Thomson Reuters Dealing Aggregator addresses FX algorithmic execution and liquidity managemen ...continued - Fixnetix appoints New York Head of Sales Eric Barret has joined the Fixnetix team as General Manager - Sales, Americas, to be based in New York. Eric is a thirteen year international industry veteran fluent in French, English and Spanish. He will assume his new role immediately and report to Jaso ...continued - Automated Trader Updates Consultancy and monitoring services in the news this week as Nomura launched its Execution Consulting Services in Asia Pacific, Bloomberg expanded its team of independent research providers, OMGEO announced a hedge fund operations forum, Alpari selected De ...continued - Reuters & Panopticon embed data visualization technology into quant trading platform Thomson Reuters has joined forces with Panopticon Software, a provider of visual data analysis solutions, to embed data visualization capabilities into the Thomson Reuters Enterprise Platform for Velocity Analytics. These new capabilities are available bot ...continued - NYSE Euronext appoints Head of European Communications NYSE Euronext (NYX) has announced the appointment of Caroline Nico as Head of European Communications, based in Paris. Caroline, who joined the group from Brunswick, will be responsible for corporate communications across NYSE Euronext's European bu ...continued"
100	IMF Chief May Have Been Riding Dirty! (PHOTOS)	"As if the sex scandal involving IMF chief Dominique Strauss-Kahn couldn't get any crazier, it was reported today that his alleged sexual assault victim lives in an apartment in the Bronx which only rents to individuals living with HIV or AIDS.
The New York Post reported that the West African hotel maid who was allegedly assaulted by Strauss-Kahn lived in one such household with her 15-year old daughter."	"As if the sex scandal involving IMF chief Dominique Strauss-Kahn couldn't get any crazier, it was reported today that his alleged sexual assault victim lives in an apartment in the Bronx which only rents to individuals living with HIV or AIDS. Put two and two together and the future looks even bleaker for Strauss-Kahn, who's on suicide watch at Rikers Island after being charged with attempted rape of a 32-year-old Manhattan hotel maid. Harlem Community AIDS United, a non-profit organization, provides housing exclusively to people living with AIDS or HIV and their families. The New York Post reported that the West African hotel maid who was allegedly assaulted by Strauss-Kahn lived in one such household with her 15-year old daughter. In order to qualify for an apartment, at least one adult living there must be HIV-positive or have AIDS. Since the alleged victim's daughter is a minor, there is speculation that the victim likely has HIV or AIDS."
101	Europe says next IMF chief must come from EU	"Europe says next IMF chief must come from EU DON MELVIN and BRADLEY KLAPPER - The Globe and Mail The European Commission insisted Thursday that next leader of the International Monetary Fund must come from the 27-nation European Union, a stance backed by the Germany, the continent's economic heavyweight.
Other potential European candidates include Germany's former central bank chief, Axel Weber; the head of Europe's bailout fund, Klaus Regling; and Peer Steinbrueck, a former German finance minister."	"Europe says next IMF chief must come from EU DON MELVIN and BRADLEY KLAPPER - The Globe and Mail The European Commission insisted Thursday that next leader of the International Monetary Fund must come from the 27-nation European Union, a stance backed by the Germany, the continent's economic heavyweight. Frenchman Dominique Strauss-Kahn resigned as IMF chief Wednesday, saying he wants to devote “all his energy” to fighting sexual assault charges in New York. The move heated up cross-border debate over his successor, with Europe aggressively staking its traditional claim to the job to ensure that Europe's debt crisis is given priority. Fast-growing nations such as China, Brazil and South Africa are trying to break Europe's grip on an organization empowered to direct billions of dollars to stabilize the global economy. EU Commission spokeswoman Pia Ahrenkilde Hansen said the EU wants continuity at the helm of the IMF and said its members can “identify strong candidates in the midst of the European Union.” In Berlin, German Chancellor Angela Merkel pushed for a quick decision on a successor to Strauss-Kahn and underlined her hopes that a European will get the job. “It is of great significance, of course, that we find a quick solution,” she said Thursday, without naming specific candidates. The IMF's executive board released a letter from Mr. Strauss-Kahn on Wednesday in which he denied the allegations lodged against him but said with “sadness” he felt he must resign, to protect his family and the IMF. “It is with infinite sadness that I feel compelled today to present to the executive board my resignation from my post of managing director of the IMF,” the five-paragraph letter said. “I think at this time first of my wife — whom I love more than anything — of my children, of my family, of my friends. I think also of my colleagues at the Fund. Together we have accomplished such great things over the last three years and more. “I deny with the greatest possible firmness all of the allegations that have been made against me. I want to protect this institution which I have served with honor and devotion, and especially — especially — I want to devote all my strength, all my time and all my energy to proving my innocence.” Mr. Strauss-Kahn is facing a bail hearing Thursday in New York that could have spelled the end of his leadership of the IMF anyway. He faces charges of assaulting a maid in a New York hotel room and has been jailed in New York since Monday. The maid, a 32-year-old immigrant from the West African nation of Guinea, told police that the 62-year-old Strauss-Kahn came out of the bathroom naked, chased her down, forced her to perform oral sex on him and tried to remove her underwear before she broke free and fled. The IMF's statement late Wednesday said the process of choosing a new leader would begin, but in the meantime John Lipsky would remain its acting managing director. Europeans have led the IMF since its inception after World War II. Americans have occupied both the No. 2 position at the IMF and the top post at its sister institution, the World Bank. The World Bank funds projects in developing countries. France's Finance Minister Christine Lagarde emerged as a potential candidate. A sharp, articulate negotiator with impeccable English who lived for many years in the United States, Ms. Lagarde has a strong international reputation. “I am convinced that she is a good candidate. I made a few trips with her to Asia. I was able to verify her popularity among ministers of large emerging countries,” France's transport minister, Thierry Mariani, told France-Info radio Thursday. While Ms. Lagarde's name has surfaced in other capitals, Mr. Mariani was the first member of the French government to speak about it publicly. However, Ms. Lagarde is a member of French President Nicolas Sarkozy's conservative UMP party, and if Mr. Sarkozy openly pushes for her candidacy, that could feed widespread belief in France that the accusations against Mr. Strauss-Kahn were part of a conspiracy to knock him off his path toward the French presidency. “There is no time to waste, because we have a lot of issues to deal with,” French Foreign Ministry spokesman Bernard Valero told The Associated Press on Thursday. Developing nations see Europe's stranglehold on the position as increasingly out of touch with the world economy. China's is now the world's second largest economy. India's and Brazil's have cracked the top 10. Many emerging economies are sitting on stockpiles of cash and have become forces of financial stability, while rich countries have become weighed down by debt. “We must establish meritocracy, so that the person leading the IMF is selected for their merits and not for being European,” Brazilian Finance Minister Guido Mantega said, calling for a “new criteria” for leadership. “You can have a competent European ... but you can have a representative from an emerging nation who is competent as well.” China suggested it was time to shake things up at the IMF, with Foreign Ministry spokeswoman Jiang Yu saying the leadership “should be based on fairness, transparency and merit.” The United States has a major say in determining who will head the fund, in part because it holds the largest number of votes. The prevailing view among analysts and former Treasury officials appears to be that Washington would back a strong European candidate who could be approved in a smooth process. Other potential European candidates include Germany's former central bank chief, Axel Weber; the head of Europe's bailout fund, Klaus Regling; and Peer Steinbrueck, a former German finance minister. Candidates from elsewhere include Turkey's former finance minister, Kemal Dervis; Singapore's finance chief, Tharman Shanmugaratnam; and Indian economist Montek Singh Ahluwalia. ——— Klapper reported from Washington. Geir Moulson from Berlin and Angela Charlton from Paris also contributed to this report."
102	Brazil wants next IMF chief from Developing Nation	"© 2010 Oman Tribune.
Best viewed in 800 X 600 resolution."	© 2010 Oman Tribune. All rights reserved. Best viewed in 800 X 600 resolution
103	IMF's women staffers want 'female boss on top'	"In fact, in the e-mails exchanged among numerous female workers at the IMF late last week in response to a 'New York Times' article titled, 'At IMF, Men on Prowl and Women on Guard', women are bemoaning a ""male dominated workplace"" where ""gender stats speak for themselves"".
Post a comment Email this article Mail This Article Print this article Save this article My saved articles (Login) (Register@indiatimes) Reduce font size Increase font size For International Business news updates, follow ET on Twitter NEXT STORY Japan's TEPCO admits further."	"WASHINGTON: As the International Monetary Fund prepares to replace its disgraced former chief, Dominique Strauss-Kahn, women employees have called for a female boss at the helm of the financial institution, a media report said. 'CNN' claims to have obtained e-mails which suggest the female staff have for long been complaining about the male culture at the IMF and they now want a woman to run the global economic organisation. In fact, in the e-mails exchanged among numerous female workers at the IMF late last week in response to a 'New York Times' article titled, 'At IMF, Men on Prowl and Women on Guard', women are bemoaning a ""male dominated workplace"" where ""gender stats speak for themselves"". One female worker in her e-mail asks whether the IMF would be better off with a woman in charge ""to end such a negative impression"". She tells colleagues: ""We now have a good opportunity to voice it out."" Another e-mail reads: ""Would be naive to pretend that there is no glass ceiling."" Responding to the leaked e-mails, IMF spokesman Bill Murray told 'CNN' that the fund ""isn't satisfied with the level of diversity at senior management level and is working to improve this."" The IMF is to begin accepting nominations for the replacement of 62-year-old Strauss-Kahn who resigned last week in the wake of allegations that he tried to rape a chambermaid in his suite at a New York hotel on May 14. He was arrested by the police, but he is now out on bail. He denies the charges. Britain said over the weekend it would back French Finance Minister Christine Lagarde for the position. The fund said Friday that it aims to complete the selection process by June 30. Post a comment Email this article Mail This Article Print this article Save this article My saved articles (Login) (Register@indiatimes) Reduce font size Increase font size For International Business news updates, follow ET on Twitter NEXT STORY Japan's TEPCO admits further... - LATEST FROM ET - LATEST FROM WEB (Advertisement) - MOST READ - MOST COMMENTED - MOST SHARED (Advertisement) (Advertisement) Slide Shows 1 / 6 more » Trade penny stocks with caution Many investors see multibaggers in penny stocks, but this tricky space has to be treaded with caution (Trade penny stocks with caution) Online term insurance plan offer big savings Life insurance premiums have progressively come down in the past two years with the launch of online term plans. (Online term insurance plan offer big savings) Here's how you can reduce the strain on your budget caused by the petrol price hike In the past nine months, petrol prices have been hiked as many times, from Rs 47.93 per litre to Rs 63.37. (Here's how you can reduce the strain on your budget caused by the petrol price hike) Funding child education: Take loan for tax benefits Instead of using your savings, it's better to go for an education loan (Funding child education: Take loan for tax benefits) Modified mutual fund schemes: How it can impact your returns What if the MF doesn't conform to the investor's expectations? (Modified mutual fund schemes: How it can impact your returns) Do you need a financial adviser to manage your finance? Check out It is important to get the true worth of your money (Do you need a financial adviser to manage your finance? Check out)"
104	AP sources: DNA matches Strauss-Kahn in sex attack	"The people say DNA found on the maid's shirt match to a sample of Dominique Strauss-Kahn's DNA.
Curious onlookers and a throng of reporters desperate for a glimpse into Dominique Strauss-Kahn's life under house arrest were rewarded with a sighting of the former IMF leader's wife leaving their luxury high-rise.
The 62-year-old Strauss-Kahn, once a French presidential contender, remains ensconced in the granite skyscraper as cameras and armed guards keep watch."	"NEW YORK New tests have found that the DNA of the former International Monetary Fund leader matches material found on the shirt of a hotel maid who says he attacked her. Two people familiar with the investigation tell The Associated Press that the tests were returned Monday afternoon. The people weren't authorized to speak publicly about the matter and spoke to the AP on condition of anonymity. The people say DNA found on the maid's shirt match to a sample of Dominique Strauss-Kahn's DNA. Strauss-Kahn attorney Benjamin Brafman declined to comment Monday. At a court hearing last week, Brafman told a judge that evidence from the incident won't be consistent with a forcible encounter. Strauss-Kahn faces charges including attempted rape and sexual abuse in the May 14 incident at New York's Sofitel Hotel. THIS IS A BREAKING NEWS UPDATE. Check back soon for further information. AP's earlier story is below. Curious onlookers and a throng of reporters desperate for a glimpse into Dominique Strauss-Kahn's life under house arrest were rewarded with a sighting of the former IMF leader's wife leaving their luxury high-rise. Anne Sinclair, a prominent French TV journalist before her marriage to Strauss-Kahn, left the couple's temporary apartment in lower Manhattan late Sunday morning and stepped into a waiting SUV. She returned four hours later, her activities a mystery. The 62-year-old Strauss-Kahn, once a French presidential contender, remains ensconced in the granite skyscraper as cameras and armed guards keep watch. Outside, open-top buses slow down as tourists snap photos of Strauss-Kahn's temporary home. Since Strauss-Kahn was moved there Friday from his Rikers Island jail cell, a crowd of international reporters has been gathered around the clock. The cost to secure him has been estimated at $200,000 a month. The funds, which he must cover, will go toward armed surveillance, the installation of cameras and a special bracelet shackled to his ankle that will set off an alarm if he travels too far. Right now, he's not allowed out of the building at all, but after he's moved to a more permanent location, he can leave for court, doctor visits and weekly religious services. Prosecutors must be notified at least six hours before he goes anywhere. He can't be out between 10 p.m. and 6 a.m. It's not clear when Strauss-Kahn will be moved, though prosecutors have said the security company advised that Broadway apartment would be available for only three or four days. He is accused of attacking a 32-year-old housekeeper on May 14 in his $3,000-a-night hotel suite in midtown Manhattan. The West African immigrant told police he chased her down a hallway in the suite, forced her to perform oral sex and tried to remove her stockings. He is scheduled for arraignment on June 6. Another Manhattan building rejected him after residents expressed fears about the kind of 24-hour media frenzy being staged on Broadway behind police barricades. Sinclair, who is wealthy in her own right, has stood by her husband since his arrest, helping secure the $5 million bond the judge added to the bail agreement. Strauss-Kahn resigned Wednesday as managing director of the International Monetary Fund, an organization that provides billions in loans to stabilize the world economy. France's finance minister, Christine Lagarde, has emerged as a front-runner to replace Strauss-Kahn, but emerging economies have pressed for an end to Europe's traditional stranglehold on the position of IMF managing director. The IMF has been accepting nominations from member countries for candidates to succeed Strauss-Kahn. Its executive board said it plans to make its selection by the end of June."
105	Strauss-Kahn leaves jail for NYC appartment	Copyright © 2011 euronews | | JavaScript is required in order to view this article’s accompanying video Latest world news - (Pakistan blast kills 16 people) Pakistan blast kills 16 people21/05 11:23 CET - (The race is on to replace DSK as IMF chief) The race is on to replace DSK as IMF chief21/05 09:33 CET - (Russian troops fed dog food claims whistleblower) Russian troops fed dog food claims whistleblower21/05 09:03 CET - (Strauss-Kahn holed up under house arrest in Lower Manhattan) Strauss-Kahn holed up under house arrest in Lower Manhattan21/05 06:14 CET (euronews streaming LIVE) Weather...	"Ex-IMF chief Dominique Strauss-Kahn swapped one of America’s toughest jails for the bright lights of Broadway on Friday night. The former French finance minister left Rikers Island for a luxury appartment in downtown Manhattan, New York City. Strauss-Kahn spent four nights in the notorious prison. He has now been formally charged with sexually assaulting and attempting to rape a hotel chambermaid. A judge granted him bail that he agreed to wear an electronic tag and posted a 700,000 euro bond. Strauss has also surrendered all travel documents and will be monitored around the clock by an armed guard. He next appears in court on June 6. His lawyers say the 62-year-old will plead not guilty to all the charges. Copyright © 2011 euronews | | JavaScript is required in order to view this article’s accompanying video Latest world news - (Pakistan blast kills 16 people) Pakistan blast kills 16 people21/05 11:23 CET - (The race is on to replace DSK as IMF chief) The race is on to replace DSK as IMF chief21/05 09:33 CET - (Russian troops fed dog food claims whistleblower) Russian troops fed dog food claims whistleblower21/05 09:03 CET - (Strauss-Kahn holed up under house arrest in Lower Manhattan) Strauss-Kahn holed up under house arrest in Lower Manhattan21/05 06:14 CET (euronews streaming LIVE) Weather London, United Kingdom 68°F 20°C / 53°F 11°C More Weather… (noComment) euronews on facebook Most Viewed - Today - Yesterday - 7 Days - 1Israel’s Netanyahu rejects Obama’s border proposals - 2Dead bin Laden photo ‘is a fake’ - 3Judge releases Strauss-Kahn from custody - 4Wife and daughter in court to support Strauss-Kahn - 5US view: Strauss-Kahn ‘will get a fair trial’ - 1Dead bin Laden photo ‘is a fake’ - 2Wife and daughter in court to support Strauss-Kahn - 3Strauss-Kahn to be freed on bail with conditions - 4Judge grants Strauss-Kahn bail with conditions - 5Strauss-Kahn set to leave jail on bail - 1Dead bin Laden photo ‘is a fake’ - 2French politics rocked by Strauss-Kahn ‘sex scandal’ - 3DSK case as seen by the French media - 4DSK has ‘alibi’ says legal team - 5Majority of French think DSK was ‘set up’ Podcast Watch Live Sport: 06 perspectives: 18 news: 30 Sport: 38 rendez-vous: 42 (euronews: No comment) Be a No Comment TV Reporter! (noComment) - news - world news - interview - you - focus - bulletin - Africa - Americas - Asia - Europe - Middle East - streaming live - Your questions on disasters - business - corporate - markets - economy - Business Education - business weekly - Sport - football results - lifestyle - le mag - rendez-vous - cinema - musica - terra-viva - learning world - life - no comment - europa - Europe - metropolitans - reporter - i talk - the network - U talk - sci-tech - hi-tech - science - space - futuris - trends - talk planet - innovation - Extras - feedback - language lessons - mobile - podcast - rss - business guide - nocomment-tv - Picture of the day - Archives - 2011 - 2010 - 2009 - 2008 - 2007 - 2006 - 2005 - 2004 - A - Z Site Index - Current Hot Topics: - USA - IMF - The Strauss-Kahn case - Demonstration - France - Cinema - Cannes Film Festival 2011 - Spain - Dominique Strauss-Kahn - Economic crisis - account - Advertising - Business Newswires - Contact euronews - Distribution - Jobs - Related links - News 24 - NewsWires - EU Coverage - Terms & Conditions - the station Copyright © euronews 2011 euronews - International News Login Please enter your login details Username Password Login or Signup for an account Have you forgotten your password? Join the euronews community Please note: All fields are required Username Min 6, max 24 characters. Letters, numbers and _ only Email Confirm email I agree to theeuronews terms of service . Signup"
